{
  "$schema": "https://json-schema.org/draft/2020-12/schema",
  "$id": "urn:archflow:schema:v1:intent-receipt",
  "$defs": {
    "plainJson": {
      "anyOf": [
        {
          "type": "null"
        },
        {
          "type": "boolean"
        },
        {
          "type": "number"
        },
        {
          "type": "string"
        },
        {
          "type": "array",
          "items": {
            "$ref": "#/$defs/plainJson"
          }
        },
        {
          "type": "object",
          "additionalProperties": {
            "$ref": "#/$defs/plainJson"
          }
        }
      ]
    }
  },
  "type": "object",
  "properties": {
    "schema_version": {
      "type": "string",
      "const": "1"
    },
    "intent_id": {
      "$ref": "urn:archflow:schema:v1:primitives#/$defs/pathSafeId"
    },
    "task_id": {
      "$ref": "urn:archflow:schema:v1:primitives#/$defs/taskSlug"
    },
    "repository_identity_digest": {
      "$ref": "urn:archflow:schema:v1:primitives#/$defs/sha256Digest"
    },
    "tool": {
      "type": "string",
      "enum": [
        "archflow_state",
        "archflow_counter_review",
        "archflow_gate",
        "archflow_waiver"
      ]
    },
    "operation": {
      "$ref": "urn:archflow:schema:v1:primitives#/$defs/safeCode"
    },
    "request_digest": {
      "$ref": "urn:archflow:schema:v1:primitives#/$defs/sha256Digest"
    },
    "input_fingerprint": {
      "$ref": "urn:archflow:schema:v1:primitives#/$defs/sha256Digest"
    },
    "prior_revision": {
      "$ref": "urn:archflow:schema:v1:primitives#/$defs/safeInteger"
    },
    "resulting_revision": {
      "type": "integer",
      "minimum": 1,
      "maximum": 9007199254740991
    },
    "result_id": {
      "$ref": "urn:archflow:schema:v1:primitives#/$defs/safeId"
    },
    "outcome_digest": {
      "$ref": "urn:archflow:schema:v1:primitives#/$defs/sha256Digest"
    },
    "outcome": {
      "$ref": "#/$defs/plainJson"
    },
    "prepared_state_digest": {
      "$ref": "urn:archflow:schema:v1:primitives#/$defs/sha256Digest"
    },
    "prepared_state": {
      "$ref": "urn:archflow:schema:v1:task-state"
    }
  },
  "required": [
    "schema_version",
    "intent_id",
    "task_id",
    "repository_identity_digest",
    "tool",
    "operation",
    "request_digest",
    "input_fingerprint",
    "prior_revision",
    "resulting_revision",
    "result_id",
    "outcome_digest",
    "outcome",
    "prepared_state_digest",
    "prepared_state"
  ],
  "additionalProperties": false
}
