{
  "schema_version": "1",
  "intent_id": "intent-0002",
  "task_id": "mcp-integration",
  "repository_identity_digest": "1111111111111111111111111111111111111111111111111111111111111111",
  "tool": "archflow_counter_review",
  "operation": "record-counter-review",
  "request_digest": "5e6f1a2b3c4d5e6f1a2b3c4d5e6f1a2b3c4d5e6f1a2b3c4d5e6f1a2b3c4d5e6f",
  "input_fingerprint": "2222222222222222222222222222222222222222222222222222222222222222",
  "prior_revision": 6,
  "resulting_revision": 7,
  "result_id": "phase-impl-1:counter_review:2",
  "outcome_digest": "6fa62f530a984d2f0a232b529d01c9216460caa5cb3be3ca4f98cb50017c6443",
  "outcome": {
    "schema_version": "1",
    "revision": 7,
    "accepted": true,
    "notes": [
      "counter-review recorded",
      null,
      3.5
    ],
    "detail": {
      "verdict": "advisory",
      "blocking_count": 0
    }
  },
  "prepared_state_digest": "2eeaba1f902c9e02a0c7d02ba3d8fc6d9b30d5735a6e7d7bddd43dee3abdedc8",
  "prepared_state": {
    "schema_version": "1",
    "task_id": "mcp-integration",
    "repository_identity_digest": "1111111111111111111111111111111111111111111111111111111111111111",
    "revision": 7,
    "phase_instance": "phase-impl-1",
    "step": "counter_review",
    "status": "running",
    "attempt": 2,
    "input_fingerprint": "2222222222222222222222222222222222222222222222222222222222222222",
    "initialization_digest": "3333333333333333333333333333333333333333333333333333333333333333",
    "config_digest": "4444444444444444444444444444444444444444444444444444444444444444",
    "workflow_digest": "5555555555555555555555555555555555555555555555555555555555555555",
    "constitution_digest": "6666666666666666666666666666666666666666666666666666666666666666",
    "policy_base_commit": "abcdef0123456789abcdef0123456789abcdef01",
    "authoritative_results": [
      {
        "phase_instance": "design",
        "step": "produce",
        "result_digest": "7777777777777777777777777777777777777777777777777777777777777777",
        "result_id": "design:produce:1",
        "input_fingerprint": "8888888888888888888888888888888888888888888888888888888888888888",
        "manifest_path": ".archflow/tasks/mcp-integration/results/design-produce/manifest.json"
      },
      {
        "phase_instance": "phase-impl-1",
        "step": "counter_review",
        "result_digest": "9999999999999999999999999999999999999999999999999999999999999999",
        "result_id": "phase-impl-1:counter_review:1",
        "input_fingerprint": "aaaaaaaaaaaaaaaaaaaaaaaaaaaaaaaaaaaaaaaaaaaaaaaaaaaaaaaaaaaaaaaa",
        "manifest_path": ".archflow/tasks/mcp-integration/results/phase-impl-1-counter-review/manifest.json"
      },
      {
        "phase_instance": "phase-impl-1",
        "step": "produce",
        "result_digest": "bbbbbbbbbbbbbbbbbbbbbbbbbbbbbbbbbbbbbbbbbbbbbbbbbbbbbbbbbbbbbbbb",
        "result_id": "phase-impl-1:produce:1",
        "input_fingerprint": "cccccccccccccccccccccccccccccccccccccccccccccccccccccccccccccccc",
        "manifest_path": ".archflow/tasks/mcp-integration/results/phase-impl-1-produce/manifest.json"
      }
    ],
    "approvals": [
      {
        "gate_id": "gate-design-approval",
        "gate_kind": "artifact-approval",
        "subject_digest": "dddddddddddddddddddddddddddddddddddddddddddddddddddddddddddddddd",
        "decision_digest": "eeeeeeeeeeeeeeeeeeeeeeeeeeeeeeeeeeeeeeeeeeeeeeeeeeeeeeeeeeeeeeee",
        "resolved_at_revision": 3
      },
      {
        "gate_id": "gate-impl-1-drift",
        "gate_kind": "material-drift",
        "subject_digest": "ffffffffffffffffffffffffffffffffffffffffffffffffffffffffffffffff",
        "decision_digest": "0123456789abcdef0123456789abcdef0123456789abcdef0123456789abcdef",
        "resolved_at_revision": 5
      }
    ],
    "waivers": [
      {
        "gate_id": "gate-impl-1-review",
        "rule_id": "constitution:no-broad-refactor",
        "rule_version": 2,
        "subject_digest": "fedcba9876543210fedcba9876543210fedcba9876543210fedcba9876543210",
        "scope": {
          "operation": "review-trigger",
          "boundary": "subject"
        },
        "granted": true,
        "expires": "task-complete",
        "granted_at_revision": 6
      }
    ],
    "open_gate": {
      "gate_id": "gate-impl-1-commit",
      "gate_kind": "commit-authorization",
      "subject_digest": "0f0f0f0f0f0f0f0f0f0f0f0f0f0f0f0f0f0f0f0f0f0f0f0f0f0f0f0f0f0f0f0f",
      "context_digest": "f0f0f0f0f0f0f0f0f0f0f0f0f0f0f0f0f0f0f0f0f0f0f0f0f0f0f0f0f0f0f0f0",
      "frozen_state_digest": "3a1494eaf16809503723b4aed46b17474bc61526dccbe68d97bc007f6cf8701e",
      "opened_at_revision": 7
    },
    "adopted_checkpoint": {
      "revision": 7,
      "checkpoint_digest": "2b3c4d5e6f1a2b3c4d5e6f1a2b3c4d5e6f1a2b3c4d5e6f1a2b3c4d5e6f1a2b3c"
    }
  }
}
